{
  "version": "2026-03-29",
  "workspace": {
    "name": "PROGRAMSTART",
    "description": "Reusable PROGRAMBUILD template workspace with optional project attachments such as USERJOURNEY.",
    "root_readme": "README.md",
    "generated_outputs_root": "outputs",
    "bootstrap_assets": [
      ".secrets.baseline",
      ".editorconfig",
      ".gitattributes",
      ".gitignore",
      ".pre-commit-config.yaml",
      ".python-version",
      ".yamllint",
      "pyproject.toml",
      "uv.lock",
      "noxfile.py",
      "mkdocs.yml",
      "CHANGELOG.md",
      "CODEOWNERS",
      "CONTRIBUTING.md",
      "SECURITY.md",
      "requirements.txt",
      "QUICKSTART.md",
      "config/process-registry.json",
      "config/knowledge-base.json",
      "docs/dashboard-api.md",
      "docs/defaults-review.md",
      "docs/index.md",
      "docs/context-layer.md",
      "docs/knowledge-base.md",
      "docs/retrieval-architecture.md",
      "docs/reusable-patterns.md",
      "docs/toolchain.md",
      "docs/verification.md",
      "docs/workflow-model.md",
      "scripts/pb.ps1",
      "scripts/__init__.py",
      "scripts/programstart_attach.py",
      "scripts/programstart_cli.py",
      "scripts/programstart_bootstrap.py",
      "scripts/programstart_clean.py",
      "scripts/programstart_checklist_progress.py",
      "scripts/programstart_common.py",
      "scripts/programstart_command_registry.py",
      "scripts/programstart_context.py",
      "scripts/programstart_cli_smoke.py",
      "scripts/programstart_dashboard.py",
      "scripts/programstart_dashboard_golden.py",
      "scripts/programstart_dashboard_browser_smoke.py",
      "scripts/programstart_dashboard_smoke.py",
      "scripts/programstart_dist_smoke.py",
      "scripts/programstart_drift_check.py",
      "scripts/programstart_impact.py",
      "scripts/programstart_init.py",
      "scripts/programstart_log.py",
      "scripts/programstart_models.py",
      "scripts/programstart_refresh_integrity.py",
      "scripts/programstart_retrieval.py",
      "scripts/programstart_recommend.py",
      "scripts/programstart_serve.py",
      "scripts/programstart_status.py",
      "scripts/programstart_step_guide.py",
      "scripts/programstart_validate.py",
      "scripts/programstart_workflow_state.py",
      "schemas/process-registry.schema.json",
      "schemas/programbuild-state.schema.json",
      "schemas/userjourney-state.schema.json",
      "tests/conftest.py",
      "tests/test_hypothesis_retrieval.py",
      "tests/test_programstart_checklist_progress.py",
      "tests/test_programstart_cli.py",
      "tests/test_programstart_clean.py",
      "tests/test_programstart_command_registry.py",
      "tests/test_programstart_common.py",
      "tests/test_programstart_context.py",
      "tests/test_programstart_dashboard.py",
      "tests/test_programstart_dashboard_golden.py",
      "tests/test_programstart_drift_check.py",
      "tests/golden/dashboard/absent-shell.png",
      "tests/golden/dashboard/attached-shell.png",
      "tests/golden/dashboard/attached-signoff-modal.png",
      "tests/test_programstart_log.py",
      "tests/test_programstart_models.py",
      "tests/test_programstart_project_factory.py",
      "tests/test_programstart_refresh_integrity.py",
      "tests/test_programstart_retrieval.py",
      "tests/test_rag_integration.py",
      "tests/test_programstart_serve.py",
      "tests/test_programstart_status.py",
      "tests/test_programstart_step_guide.py",
      "tests/test_programstart_validate.py",
      "tests/test_programstart_workflow_state.py",
      ".github/copilot-instructions.md",
      ".github/dependabot.yml",
      ".github/instructions/programbuild.instructions.md",
      ".github/instructions/userjourney.instructions.md",
      ".github/ISSUE_TEMPLATE/bug_report.md",
      ".github/ISSUE_TEMPLATE/feature_request.md",
      ".github/PULL_REQUEST_TEMPLATE.md",
      ".github/workflows/process-guardrails.yml",
      ".github/prompts/audit-process-drift.prompt.md",
      ".github/prompts/programstart-stage-guide.prompt.md",
      ".github/prompts/programstart-what-next.prompt.md",
      ".github/prompts/start-programstart-project.prompt.md",
      ".github/prompts/userjourney-next-slice.prompt.md",
      ".vscode/tasks.json"
    ]
  },
  "systems": {
    "programbuild": {
      "root": "PROGRAMBUILD",
      "packaging": "template_repo",
      "control_files": [
        "PROGRAMBUILD/PROGRAMBUILD_CANONICAL.md",
        "PROGRAMBUILD/PROGRAMBUILD_FILE_INDEX.md",
        "PROGRAMBUILD/PROGRAMBUILD_ADR_TEMPLATE.md",
        "PROGRAMBUILD/PROGRAMBUILD_CHANGELOG.md",
        "PROGRAMBUILD/PROGRAMBUILD_STATE.json",
        "PROGRAMBUILD/PROGRAMBUILD.md",
        "PROGRAMBUILD/PROGRAMBUILD_LITE.md",
        "PROGRAMBUILD/PROGRAMBUILD_PRODUCT.md",
        "PROGRAMBUILD/PROGRAMBUILD_ENTERPRISE.md",
        "PROGRAMBUILD/PROGRAMBUILD_KICKOFF_PACKET.md",
        "PROGRAMBUILD/PROGRAMBUILD_SUBAGENTS.md",
        "PROGRAMBUILD/PROGRAMBUILD_CHECKLIST.md"
      ],
      "output_files": [
        "PROGRAMBUILD/FEASIBILITY.md",
        "PROGRAMBUILD/DECISION_LOG.md",
        "PROGRAMBUILD/RESEARCH_SUMMARY.md",
        "PROGRAMBUILD/REQUIREMENTS.md",
        "PROGRAMBUILD/USER_FLOWS.md",
        "PROGRAMBUILD/ARCHITECTURE.md",
        "PROGRAMBUILD/RISK_SPIKES.md",
        "PROGRAMBUILD/TEST_STRATEGY.md",
        "PROGRAMBUILD/RELEASE_READINESS.md",
        "PROGRAMBUILD/AUDIT_REPORT.md",
        "PROGRAMBUILD/POST_LAUNCH_REVIEW.md"
      ],
      "variants": [
        "PROGRAMBUILD/PROGRAMBUILD_LITE.md",
        "PROGRAMBUILD/PROGRAMBUILD_PRODUCT.md",
        "PROGRAMBUILD/PROGRAMBUILD_ENTERPRISE.md"
      ],
      "stage_order": [
        { "id": 0, "name": "inputs_and_mode_selection", "main_output": "inputs block" },
        { "id": 1, "name": "feasibility", "main_output": "PROGRAMBUILD/FEASIBILITY.md" },
        { "id": 2, "name": "research", "main_output": "PROGRAMBUILD/RESEARCH_SUMMARY.md" },
        { "id": 3, "name": "requirements_and_ux", "main_output": "PROGRAMBUILD/REQUIREMENTS.md" },
        { "id": 4, "name": "architecture_and_risk_spikes", "main_output": "PROGRAMBUILD/ARCHITECTURE.md" },
        { "id": 5, "name": "scaffold_and_guardrails", "main_output": "working skeleton and CI gates" },
        { "id": 6, "name": "test_strategy", "main_output": "PROGRAMBUILD/TEST_STRATEGY.md" },
        { "id": 7, "name": "implementation_loop", "main_output": "feature code and tests" },
        { "id": 8, "name": "release_readiness", "main_output": "PROGRAMBUILD/RELEASE_READINESS.md" },
        { "id": 9, "name": "audit_and_drift_control", "main_output": "PROGRAMBUILD/AUDIT_REPORT.md" },
        { "id": 10, "name": "post_launch_review", "main_output": "PROGRAMBUILD/POST_LAUNCH_REVIEW.md" }
      ],
      "metadata_required": [
        "PROGRAMBUILD/FEASIBILITY.md",
        "PROGRAMBUILD/DECISION_LOG.md",
        "PROGRAMBUILD/RESEARCH_SUMMARY.md",
        "PROGRAMBUILD/REQUIREMENTS.md",
        "PROGRAMBUILD/USER_FLOWS.md",
        "PROGRAMBUILD/ARCHITECTURE.md",
        "PROGRAMBUILD/RISK_SPIKES.md",
        "PROGRAMBUILD/TEST_STRATEGY.md",
        "PROGRAMBUILD/RELEASE_READINESS.md",
        "PROGRAMBUILD/AUDIT_REPORT.md",
        "PROGRAMBUILD/POST_LAUNCH_REVIEW.md"
      ]
    },
    "userjourney": {
      "root": "USERJOURNEY",
      "packaging": "project_attachment",
      "optional": true,
      "bootstrap_supported": false,
      "attachment_role": "example_project_attachment",
      "core_files": [
        "USERJOURNEY/README.md",
        "USERJOURNEY/USERJOURNEY_STATE.json",
        "USERJOURNEY/USERJOURNEY_INTEGRITY_REFERENCE.json",
        "USERJOURNEY/PRODUCT_SPEC.md",
        "USERJOURNEY/USER_FLOWS.md",
        "USERJOURNEY/UX_COPY_DRAFT.md",
        "USERJOURNEY/LEGAL_AND_CONSENT.md",
        "USERJOURNEY/EXTERNAL_REVIEW_PACKET.md",
        "USERJOURNEY/IMPLEMENTATION_PLAN.md",
        "USERJOURNEY/IMPLEMENTATION_TRACKER.md",
        "USERJOURNEY/EXECUTION_SLICES.md",
        "USERJOURNEY/FILE_BY_FILE_IMPLEMENTATION_CHECKLIST.md",
        "USERJOURNEY/DELIVERY_GAMEPLAN.md",
        "USERJOURNEY/SCREEN_INVENTORY.md",
        "USERJOURNEY/ROUTE_AND_STATE_FREEZE.md",
        "USERJOURNEY/LEGAL_REVIEW_NOTES.md",
        "USERJOURNEY/STATES_AND_RULES.md",
        "USERJOURNEY/ACCEPTANCE_CRITERIA.md",
        "USERJOURNEY/ANALYTICS_AND_OUTCOMES.md",
        "USERJOURNEY/TERMS_OF_SERVICE_DRAFT.md",
        "USERJOURNEY/PRIVACY_POLICY_DRAFT.md",
        "USERJOURNEY/ADDITIONAL_SUGGESTIONS.md",
        "USERJOURNEY/REUSE_STRATEGY.md",
        "USERJOURNEY/USERJOURNEY_TEMPLATE_STARTER.md",
        "USERJOURNEY/DECISION_LOG.md",
        "USERJOURNEY/OPEN_QUESTIONS.md"
      ],
      "metadata_required": [
        "USERJOURNEY/README.md",
        "USERJOURNEY/PRODUCT_SPEC.md",
        "USERJOURNEY/USER_FLOWS.md",
        "USERJOURNEY/UX_COPY_DRAFT.md",
        "USERJOURNEY/LEGAL_AND_CONSENT.md",
        "USERJOURNEY/EXTERNAL_REVIEW_PACKET.md",
        "USERJOURNEY/IMPLEMENTATION_PLAN.md",
        "USERJOURNEY/IMPLEMENTATION_TRACKER.md",
        "USERJOURNEY/EXECUTION_SLICES.md",
        "USERJOURNEY/FILE_BY_FILE_IMPLEMENTATION_CHECKLIST.md",
        "USERJOURNEY/DELIVERY_GAMEPLAN.md",
        "USERJOURNEY/SCREEN_INVENTORY.md",
        "USERJOURNEY/ROUTE_AND_STATE_FREEZE.md",
        "USERJOURNEY/LEGAL_REVIEW_NOTES.md",
        "USERJOURNEY/STATES_AND_RULES.md",
        "USERJOURNEY/ACCEPTANCE_CRITERIA.md",
        "USERJOURNEY/ANALYTICS_AND_OUTCOMES.md",
        "USERJOURNEY/TERMS_OF_SERVICE_DRAFT.md",
        "USERJOURNEY/PRIVACY_POLICY_DRAFT.md",
        "USERJOURNEY/ADDITIONAL_SUGGESTIONS.md",
        "USERJOURNEY/REUSE_STRATEGY.md",
        "USERJOURNEY/USERJOURNEY_TEMPLATE_STARTER.md",
        "USERJOURNEY/DECISION_LOG.md",
        "USERJOURNEY/OPEN_QUESTIONS.md"
      ],
      "engineering_blocker_file": "USERJOURNEY/OPEN_QUESTIONS.md",
      "activation_event": "first_value_achieved"
    }
  },
  "sync_rules": [
    {